{
  "business_name": "Bella Trattoria",
  "format": "reels",
  "duration": 40.0,
  "fps_target": 60,
  "metaphor": "ett kontinuerlig kamerasveip fra råvare til servert tallerken",
  "transition_style": "match-cut / shared-element, never hard slide",
  "scene_count": 6,
  "palette": {"primary": "#6b1f2a", "accent": "#c9a36a", "ink": "#1a1411", "paper": "#f6f1e7", "palette": ["#6b1f2a", "#c9a36a", "#1a1411"]},
  "fonts": {"heading": "Playfair Display", "body": "Inter", "fallback_heading": "Georgia, serif", "fallback_body": "-apple-system, sans-serif"},
  "scenes": [
    {"index": 0, "role": "hook", "start": 0.0, "seconds": 5.0, "end": 5.0,
     "copy": {"kicker": "I KVELD", "headline": "Det lukter nybakt focaccia", "sub": ""},
     "image": "assets/pasta-hero.jpg", "logo": "assets/logo.png",
     "motion": {"camera": "slow push-in", "type_in": "mask-reveal up", "image": "ken-burns 1.04->1.14", "style": "warm-push-in"},
     "treatment": "warm editorial grade"},
    {"index": 1, "role": "context", "start": 5.0, "seconds": 6.0, "end": 11.0,
     "copy": {"kicker": "", "headline": "Ekte italiensk — hver gang", "sub": ""},
     "image": "assets/interior.jpg", "logo": null,
     "motion": {"camera": "lateral drift", "type_in": "line clip", "image": "parallax bg", "style": "warm-push-in"},
     "treatment": "warm editorial grade"},
    {"index": 2, "role": "offer", "start": 11.0, "seconds": 9.0, "end": 20.0,
     "copy": {"kicker": "PÅ MENYEN", "headline": "Pasta laget for hånd", "sub": "Pizza fra steinovn, Tiramisu, Vinkart"},
     "image": "assets/pizza.jpg", "logo": null,
     "motion": {"camera": "rack-focus to product", "type_in": "stagger up", "image": "scale 1.1->1.0", "style": "warm-push-in"},
     "treatment": "warm editorial grade"},
    {"index": 3, "role": "proof", "start": 20.0, "seconds": 7.0, "end": 27.0,
     "copy": {"kicker": "", "headline": "4,9★ · 412 omtaler · siden 2011", "sub": ""},
     "image": "assets/chef.jpg", "logo": null,
     "motion": {"camera": "settle", "type_in": "fade", "image": "subtle drift", "style": "warm-push-in"},
     "treatment": "warm editorial grade"},
    {"index": 4, "role": "offer", "start": 27.0, "seconds": 6.0, "end": 33.0,
     "copy": {"kicker": "FRA 189,-", "headline": "Søtt til slutt", "sub": "Hjemmelaget tiramisu"},
     "image": "assets/dessert.jpg", "logo": null,
     "motion": {"camera": "rack-focus to product", "type_in": "stagger up", "image": "scale 1.1->1.0", "style": "warm-push-in"},
     "treatment": "warm editorial grade"},
    {"index": 5, "role": "cta", "start": 33.0, "seconds": 7.0, "end": 40.0,
     "copy": {"kicker": "BELLA TRATTORIA", "headline": "Bestill bord", "sub": "Storgata 4, Oslo · +47 22 33 44 55"},
     "image": "assets/pasta-hero.jpg", "logo": "assets/logo.png",
     "motion": {"camera": "pull to logo", "type_in": "logo draw + clamp", "image": "vignette focus", "style": "warm-push-in"},
     "treatment": "warm editorial grade"}
  ]
}
